<?xml version="1.0" encoding="UTF-8"?>

<minta     xmlns:xsi="http://www.w3.org/2001/XMLSchema-instance"
            xsi:noNamespaceSchemaLocation="DMT_ertoxsd.xsd">
	<A Aa="01">
		<Ab>
			<Abx>
			haha
			</Abx>
			<Aby>
			hahaha
			</Aby>
		</Ab>
		<Ac>
			<Acd>
			József
			</Acd>
			<Ace>
			Balázs
			</Ace>
		</Ac>
	</A>
	<B Ba="01" Bc="01">
		<Bb>
			<Bbx>
			Kossuth
			</Bbx>
			<Bby>
			Lajos
			</Bby>
		</Bb>
	</B>
	<C Ca="01">
		<Cb>
		hahahahahaha
		</Cb>
	</C>
	<A_B A_B_a="01" A_B_b="01">
		<A_Bc>
		nagyon jó
		</A_Bc>
	</A_B>
</minta>